"Status","Start Time","Stop Time","Duration in ms","Parent Suite","Suite","Sub Suite","Test Class","Test Method","Name","Description"
"passed","Thu Mar 13 21:22:01 GMT 2025","Thu Mar 13 21:22:02 GMT 2025","440","PFLB Poligon SmokeTests","Tests","tests.apiTests.AuthorizationApiTest","tests.apiTests.AuthorizationApiTest","getAccessToken2","getAccessToken2",""
"passed","Thu Mar 13 21:16:03 GMT 2025","Thu Mar 13 21:16:07 GMT 2025","4530","PFLB Poligon SmokeTests","Tests","tests.uiTests.CreateNewHouseTest","tests.uiTests.CreateNewHouseTest","createNewHouse","Проверка создания дома со всеми заполненными полями","Проверка создания дома со всеми заполненными полями"
"passed","Thu Mar 13 21:13:05 GMT 2025","Thu Mar 13 21:13:10 GMT 2025","4502","PFLB Poligon SmokeTests","Tests","tests.uiTests.CreateNewUserTest","tests.uiTests.CreateNewUserTest","createUserTest","Проверка создания пользователя с корректными данными","Проверка создания пользователя с корректными данными"
"passed","Thu Mar 13 21:11:21 GMT 2025","Thu Mar 13 21:11:36 GMT 2025","14672","PFLB Poligon SmokeTests","Tests","tests.uiTests.CreateNewUserTest","tests.uiTests.CreateNewUserTest","checkNotCreatedUserTest","Проверка отсутствия создания пользователя с Некорректными данными","Проверка отсутствия создания пользователя с Некорректными данными"
"passed","Thu Mar 13 21:21:58 GMT 2025","Thu Mar 13 21:21:59 GMT 2025","663","PFLB Poligon SmokeTests","Tests","tests.uiTests.GetCarsListFromUserTest","tests.uiTests.GetCarsListFromUserTest","getCarsList","Проверка списка машин по id юзера","Проверка списка машин по id юзера"
"passed","Thu Mar 13 21:09:53 GMT 2025","Thu Mar 13 21:10:00 GMT 2025","6496","PFLB Poligon SmokeTests","Tests","tests.uiTests.CheckInCheckOutTest","tests.uiTests.CheckInCheckOutTest","settleUser","settleUser",""
"passed","Thu Mar 13 21:12:33 GMT 2025","Thu Mar 13 21:12:48 GMT 2025","14681","PFLB Poligon SmokeTests","Tests","tests.uiTests.CreateNewUserTest","tests.uiTests.CreateNewUserTest","checkNotCreatedUserTest","Проверка отсутствия создания пользователя с Некорректными данными","Проверка отсутствия создания пользователя с Некорректными данными"
"passed","Thu Mar 13 21:17:58 GMT 2025","Thu Mar 13 21:18:02 GMT 2025","4460","PFLB Poligon SmokeTests","Tests","tests.uiTests.CreateNewHouseTest","tests.uiTests.CreateNewHouseTest","createNewHouseNoParking","Проверка создания дома без паркинга","Проверка создания дома без паркинга"
"passed","Thu Mar 13 21:10:27 GMT 2025","Thu Mar 13 21:10:34 GMT 2025","6362","PFLB Poligon SmokeTests","Tests","tests.uiTests.CheckInCheckOutTest","tests.uiTests.CheckInCheckOutTest","incorrectEvictUserTest","incorrectEvictUserTest",""
"passed","Thu Mar 13 21:18:10 GMT 2025","Thu Mar 13 21:18:20 GMT 2025","9328","PFLB Poligon SmokeTests","Tests","tests.uiTests.CreateNewHouseTest","tests.uiTests.CreateNewHouseTest","deleteHouseTest","Проверка удаления дома с корректным ID","Проверка удаления дома с корректным ID"
"passed","Thu Mar 13 21:17:40 GMT 2025","Thu Mar 13 21:17:55 GMT 2025","14657","PFLB Poligon SmokeTests","Tests","tests.uiTests.CreateNewHouseTest","tests.uiTests.CreateNewHouseTest","createNewHouseNegative","Проверка отказа создания дома с невалидными данными","Проверка отказа создания дома с невалидными данными"
"passed","Thu Mar 13 21:10:10 GMT 2025","Thu Mar 13 21:10:17 GMT 2025","6369","PFLB Poligon SmokeTests","Tests","tests.uiTests.CheckInCheckOutTest","tests.uiTests.CheckInCheckOutTest","incorrectSettleUserTest","incorrectSettleUserTest",""
"passed","Thu Mar 13 21:09:34 GMT 2025","Thu Mar 13 21:09:36 GMT 2025","1440","PFLB Poligon SmokeTests","Tests","tests.uiTests.LoginTest","tests.uiTests.LoginTest","correctLogin","correctLogin",""
"passed","Thu Mar 13 21:17:04 GMT 2025","Thu Mar 13 21:17:19 GMT 2025","14615","PFLB Poligon SmokeTests","Tests","tests.uiTests.CreateNewHouseTest","tests.uiTests.CreateNewHouseTest","createNewHouseNegative","Проверка отказа создания дома с невалидными данными","Проверка отказа создания дома с невалидными данными"
"passed","Thu Mar 13 21:18:27 GMT 2025","Thu Mar 13 21:18:39 GMT 2025","11846","PFLB Poligon SmokeTests","Tests","tests.uiTests.SellAndBuyCarTest","tests.uiTests.SellAndBuyCarTest","buyCarTest","Проверка покупки машины","Проверка покупки машины"
"passed","Thu Mar 13 21:22:19 GMT 2025","Thu Mar 13 21:22:22 GMT 2025","3426","PFLB Poligon SmokeTests","Tests","tests.apiTests.CarApiTest","tests.apiTests.CarApiTest","CarCRUDTest","CarCRUDTest","Создание, чтение, изменение, удаление автомобиля"
"passed","Thu Mar 13 21:09:45 GMT 2025","Thu Mar 13 21:09:46 GMT 2025","359","PFLB Poligon SmokeTests","Tests","tests.uiTests.LoginTest","tests.uiTests.LoginTest","incorrectLogin","incorrectLogin",""
"passed","Thu Mar 13 21:09:40 GMT 2025","Thu Mar 13 21:09:41 GMT 2025","723","PFLB Poligon SmokeTests","Tests","tests.uiTests.LoginTest","tests.uiTests.LoginTest","fieldPasswordWrongLogin","fieldPasswordWrongLogin",""
"passed","Thu Mar 13 21:16:15 GMT 2025","Thu Mar 13 21:16:20 GMT 2025","4945","PFLB Poligon SmokeTests","Tests","tests.uiTests.CreateNewHouseTest","tests.uiTests.CreateNewHouseTest","createNewHouseFractionalNumberOfFloors","Проверка создания дома с дробным количеством этажей - округление этажности до целого в меньшую сторону","Проверка создания дома с дробным количеством этажей - округление до целого в меньшую сторону"
"passed","Thu Mar 13 21:21:59 GMT 2025","Thu Mar 13 21:22:01 GMT 2025","2500","PFLB Poligon SmokeTests","Tests","tests.apiTests.AuthorizationApiTest","tests.apiTests.AuthorizationApiTest","getAccessToken","getAccessToken",""
"passed","Thu Mar 13 21:22:13 GMT 2025","Thu Mar 13 21:22:15 GMT 2025","2079","PFLB Poligon SmokeTests","Tests","tests.apiTests.HouseApiTest","tests.apiTests.HouseApiTest","deleteHouse","deleteHouse","Проверка удаления нового дома с корректными параметрами"
"passed","Thu Mar 13 21:10:19 GMT 2025","Thu Mar 13 21:10:25 GMT 2025","6343","PFLB Poligon SmokeTests","Tests","tests.uiTests.CheckInCheckOutTest","tests.uiTests.CheckInCheckOutTest","incorrectSettleHouseTest","incorrectSettleHouseTest",""
"passed","Thu Mar 13 21:14:56 GMT 2025","Thu Mar 13 21:15:11 GMT 2025","14560","PFLB Poligon SmokeTests","Tests","tests.uiTests.CreateNewCarTest","tests.uiTests.CreateNewCarTest","createNewCarWithEmptyMarkField","Тест создания автомобиля с пустым полем Mark","Тест создания автомобиля с пустым полем Mark"
"passed","Thu Mar 13 21:11:39 GMT 2025","Thu Mar 13 21:11:54 GMT 2025","14666","PFLB Poligon SmokeTests","Tests","tests.uiTests.CreateNewUserTest","tests.uiTests.CreateNewUserTest","checkNotCreatedUserTest","Проверка отсутствия создания пользователя с Некорректными данными","Проверка отсутствия создания пользователя с Некорректными данными"
"passed","Thu Mar 13 21:22:11 GMT 2025","Thu Mar 13 21:22:11 GMT 2025","697","PFLB Poligon SmokeTests","Tests","tests.apiTests.UserInfoApiTest","tests.apiTests.UserInfoApiTest","getUserInfoTest","Проверка информации по ID пользователя","Проверка информации по ID пользователя"
"passed","Thu Mar 13 21:15:14 GMT 2025","Thu Mar 13 21:15:29 GMT 2025","14560","PFLB Poligon SmokeTests","Tests","tests.uiTests.CreateNewCarTest","tests.uiTests.CreateNewCarTest","createNewCarWithEmptyModelField","Тест создания автомобиля с пустым полем Model","Тест создания автомобиля с пустым полем Model"
"passed","Thu Mar 13 21:15:50 GMT 2025","Thu Mar 13 21:15:55 GMT 2025","5024","PFLB Poligon SmokeTests","Tests","tests.uiTests.CreateNewHouseTest","tests.uiTests.CreateNewHouseTest","checkHouseById","Проверка получения данных о доме по ID","Проверка получения данных о доме по ID"
"passed","Thu Mar 13 21:22:11 GMT 2025","Thu Mar 13 21:22:13 GMT 2025","2128","PFLB Poligon SmokeTests","Tests","tests.apiTests.HouseApiTest","tests.apiTests.HouseApiTest","createHouse","createHouse","Проверка создания нового дома с корректными параметрами"
"passed","Thu Mar 13 21:22:03 GMT 2025","Thu Mar 13 21:22:04 GMT 2025","1440","PFLB Poligon SmokeTests","Tests","tests.apiTests.UserApiTest","tests.apiTests.UserApiTest","getUserTest","Проверка получения атрибутов по ID пользователя","Проверка получения атрибутов по ID пользователя"
"passed","Thu Mar 13 21:18:47 GMT 2025","Thu Mar 13 21:18:48 GMT 2025","716","PFLB Poligon SmokeTests","Tests","tests.uiTests.PlusMoneyTest","tests.uiTests.PlusMoneyTest","testAddMoneyToUser","Ввод корректного id и суммы.",""
"passed","Thu Mar 13 21:22:23 GMT 2025","Thu Mar 13 21:22:24 GMT 2025","1364","PFLB Poligon SmokeTests","Tests","tests.apiTests.CarApiTest","tests.apiTests.CarApiTest","getCarTest","Проверка получения атрибутов по ID автомобиля","Проверка получения атрибутов по ID автомобиля"
"passed","Thu Mar 13 21:13:25 GMT 2025","Thu Mar 13 21:13:36 GMT 2025","10799","PFLB Poligon SmokeTests","Tests","tests.uiTests.CreateNewUserTest","tests.uiTests.CreateNewUserTest","deleteUserTest","Проверка удаления пользователя с корректным ID","Проверка удаления пользователя с корректным ID"
"passed","Thu Mar 13 21:16:46 GMT 2025","Thu Mar 13 21:17:01 GMT 2025","14688","PFLB Poligon SmokeTests","Tests","tests.uiTests.CreateNewHouseTest","tests.uiTests.CreateNewHouseTest","createNewHouseNegative","Проверка отказа создания дома с невалидными данными","Проверка отказа создания дома с невалидными данными"
"passed","Thu Mar 13 21:15:32 GMT 2025","Thu Mar 13 21:15:47 GMT 2025","14565","PFLB Poligon SmokeTests","Tests","tests.uiTests.CreateNewCarTest","tests.uiTests.CreateNewCarTest","createNewCarWithEmptyPriceField","Тест создания автомобиля с пустым полем Price","Тест создания автомобиля с пустым полем Price"
"passed","Thu Mar 13 21:19:00 GMT 2025","Thu Mar 13 21:19:00 GMT 2025","717","PFLB Poligon SmokeTests","Tests","tests.uiTests.PlusMoneyTest","tests.uiTests.PlusMoneyTest","testAddMoneyNonExistentUser","Ввод некорректного id и суммы.",""
"passed","Thu Mar 13 21:10:45 GMT 2025","Thu Mar 13 21:11:00 GMT 2025","14829","PFLB Poligon SmokeTests","Tests","tests.uiTests.CreateNewUserTest","tests.uiTests.CreateNewUserTest","checkNotCreatedUserTest","Проверка отсутствия создания пользователя с Некорректными данными","Проверка отсутствия создания пользователя с Некорректными данными"
"passed","Thu Mar 13 21:17:22 GMT 2025","Thu Mar 13 21:17:37 GMT 2025","14659","PFLB Poligon SmokeTests","Tests","tests.uiTests.CreateNewHouseTest","tests.uiTests.CreateNewHouseTest","createNewHouseNegative","Проверка отказа создания дома с невалидными данными","Проверка отказа создания дома с невалидными данными"
"passed","Thu Mar 13 21:12:51 GMT 2025","Thu Mar 13 21:12:58 GMT 2025","6821","PFLB Poligon SmokeTests","Tests","tests.uiTests.CreateNewUserTest","tests.uiTests.CreateNewUserTest","checkUserOnTableTest","Проверка отображения созданного пользователя в таблице Read all","Проверка отображения созданного пользователя в таблице Read all"
"passed","Thu Mar 13 21:22:25 GMT 2025","Thu Mar 13 21:22:28 GMT 2025","2979","PFLB Poligon SmokeTests","Tests","tests.apiTests.GetCarsListFromUserApiTest","tests.apiTests.GetCarsListFromUserApiTest","getCarsListApiTest","Проверка, что API возвращает список машин","Сравнение списка машин пользователя"
"passed","Thu Mar 13 21:14:03 GMT 2025","Thu Mar 13 21:14:13 GMT 2025","10706","PFLB Poligon SmokeTests","Tests","tests.uiTests.CreateNewCarTest","tests.uiTests.CreateNewCarTest","deleteNewCarWithValidData","Тест удаления созданного автомобиля","Тест удаления созданного автомобиля"
"passed","Thu Mar 13 21:09:48 GMT 2025","Thu Mar 13 21:09:48 GMT 2025","355","PFLB Poligon SmokeTests","Tests","tests.uiTests.LoginTest","tests.uiTests.LoginTest","incorrectPassword","incorrectPassword",""
"passed","Thu Mar 13 21:10:02 GMT 2025","Thu Mar 13 21:10:08 GMT 2025","6372","PFLB Poligon SmokeTests","Tests","tests.uiTests.CheckInCheckOutTest","tests.uiTests.CheckInCheckOutTest","evictUser","evictUser",""
"passed","Thu Mar 13 21:13:43 GMT 2025","Thu Mar 13 21:13:48 GMT 2025","4430","PFLB Poligon SmokeTests","Tests","tests.uiTests.CreateNewCarTest","tests.uiTests.CreateNewCarTest","createNewCarWithValidData","Тест создания автомобиля с валидными данными","Тест создания автомобиля с валидными данными"
"passed","Thu Mar 13 21:09:43 GMT 2025","Thu Mar 13 21:09:43 GMT 2025","279","PFLB Poligon SmokeTests","Tests","tests.uiTests.LoginTest","tests.uiTests.LoginTest","fieldPasswordEmptyLogin","fieldPasswordEmptyLogin",""
"passed","Thu Mar 13 21:16:29 GMT 2025","Thu Mar 13 21:16:43 GMT 2025","14675","PFLB Poligon SmokeTests","Tests","tests.uiTests.CreateNewHouseTest","tests.uiTests.CreateNewHouseTest","createNewHouseNegative","Проверка отказа создания дома с невалидными данными","Проверка отказа создания дома с невалидными данными"
"passed","Thu Mar 13 21:09:50 GMT 2025","Thu Mar 13 21:09:51 GMT 2025","387","PFLB Poligon SmokeTests","Tests","tests.uiTests.LoginTest","tests.uiTests.LoginTest","incorrectPasswordAndEmail","incorrectPasswordAndEmail",""
"passed","Thu Mar 13 21:10:36 GMT 2025","Thu Mar 13 21:10:42 GMT 2025","6381","PFLB Poligon SmokeTests","Tests","tests.uiTests.CheckInCheckOutTest","tests.uiTests.CheckInCheckOutTest","incorrectEvictHouseTest","incorrectEvictHouseTest",""
"passed","Thu Mar 13 21:19:13 GMT 2025","Thu Mar 13 21:19:13 GMT 2025","235","PFLB Poligon SmokeTests","Tests","tests.uiTests.PlusMoneyTest","tests.uiTests.PlusMoneyTest","testEnteringIncorrectAmount","Ввод корректного id и отрицательной суммы.",""
"passed","Thu Mar 13 21:13:17 GMT 2025","Thu Mar 13 21:13:22 GMT 2025","4341","PFLB Poligon SmokeTests","Tests","tests.uiTests.CreateNewUserTest","tests.uiTests.CreateNewUserTest","deleteNonExistUserTest","Проверка удаления пользователя с Некорректным ID","Проверка удаления пользователя с Некорректным ID"
"passed","Thu Mar 13 21:14:21 GMT 2025","Thu Mar 13 21:14:35 GMT 2025","14565","PFLB Poligon SmokeTests","Tests","tests.uiTests.CreateNewCarTest","tests.uiTests.CreateNewCarTest","createNewCarWithEmptyEngineTypeField","Тест создания автомобиля с пустым полем Engine Type","Тест создания автомобиля с пустым полем Engine Type"
"passed","Thu Mar 13 21:11:03 GMT 2025","Thu Mar 13 21:11:18 GMT 2025","14646","PFLB Poligon SmokeTests","Tests","tests.uiTests.CreateNewUserTest","tests.uiTests.CreateNewUserTest","checkNotCreatedUserTest","Проверка отсутствия создания пользователя с Некорректными данными","Проверка отсутствия создания пользователя с Некорректными данными"
"passed","Thu Mar 13 21:09:38 GMT 2025","Thu Mar 13 21:09:38 GMT 2025","247","PFLB Poligon SmokeTests","Tests","tests.uiTests.LoginTest","tests.uiTests.LoginTest","fieldsEmptyLogin","fieldsEmptyLogin",""
"passed","Thu Mar 13 21:11:57 GMT 2025","Thu Mar 13 21:12:12 GMT 2025","14665","PFLB Poligon SmokeTests","Tests","tests.uiTests.CreateNewUserTest","tests.uiTests.CreateNewUserTest","checkNotCreatedUserTest","Проверка отсутствия создания пользователя с Некорректными данными","Проверка отсутствия создания пользователя с Некорректными данными"
"passed","Thu Mar 13 21:22:15 GMT 2025","Thu Mar 13 21:22:18 GMT 2025","2804","PFLB Poligon SmokeTests","Tests","tests.apiTests.HouseApiTest","tests.apiTests.HouseApiTest","updateHouse","updateHouse","Проверка изменения параметров дома"
"passed","Thu Mar 13 21:21:38 GMT 2025","Thu Mar 13 21:21:39 GMT 2025","701","PFLB Poligon SmokeTests","Tests","tests.uiTests.CreditTest","tests.uiTests.CreditTest","testAddMoneyNonExistentUser","Ввод некорректного id и суммы.",""
"passed","Thu Mar 13 21:22:33 GMT 2025","Thu Mar 13 21:22:34 GMT 2025","1158","PFLB Poligon SmokeTests","Tests","tests.dbTests.CarDbTest","tests.dbTests.CarDbTest","checkUserDBTest","Проверка информации по Car в БД","Проверка информации по Car в БД"
"passed","Thu Mar 13 21:14:39 GMT 2025","Thu Mar 13 21:14:53 GMT 2025","14609","PFLB Poligon SmokeTests","Tests","tests.uiTests.CreateNewCarTest","tests.uiTests.CreateNewCarTest","createNewCarWithNotValidEngineTypeField","Тест создания автомобиля с не валидными данными в поле Engine Type","Тест создания автомобиля с не валидными данными в поле Engine Type"
"passed","Thu Mar 13 21:22:29 GMT 2025","Thu Mar 13 21:22:30 GMT 2025","1488","PFLB Poligon SmokeTests","Tests","tests.dbTests.UserDbTest","tests.dbTests.UserDbTest","checkUserDBTest","Проверка информации по ID пользователя в БД","Проверка информации по ID пользователя в БД"
"passed","Thu Mar 13 21:19:25 GMT 2025","Thu Mar 13 21:21:26 GMT 2025","120950","PFLB Poligon SmokeTests","Tests","tests.uiTests.CreditTest","tests.uiTests.CreditTest","testLoanFailure","Ввод корректного id и суммы.",""
"passed","Thu Mar 13 21:21:51 GMT 2025","Thu Mar 13 21:21:51 GMT 2025","221","PFLB Poligon SmokeTests","Tests","tests.uiTests.CreditTest","tests.uiTests.CreditTest","testEnteringIncorrectAmount","Ввод корректного id и отрицательной суммы.",""
"passed","Thu Mar 13 21:13:55 GMT 2025","Thu Mar 13 21:14:00 GMT 2025","4290","PFLB Poligon SmokeTests","Tests","tests.uiTests.CreateNewCarTest","tests.uiTests.CreateNewCarTest","deleteNewCarWithNotValidData","Тест удаления не существующего автомобиля","Тест удаления не существующего автомобиля"
"passed","Thu Mar 13 21:12:15 GMT 2025","Thu Mar 13 21:12:30 GMT 2025","14700","PFLB Poligon SmokeTests","Tests","tests.uiTests.CreateNewUserTest","tests.uiTests.CreateNewUserTest","checkNotCreatedUserTest","Проверка отсутствия создания пользователя с Некорректными данными","Проверка отсутствия создания пользователя с Некорректными данными"
"passed","Thu Mar 13 21:22:05 GMT 2025","Thu Mar 13 21:22:08 GMT 2025","3464","PFLB Poligon SmokeTests","Tests","tests.apiTests.UserApiTest","tests.apiTests.UserApiTest","workFlowTest","workFlowTest","Создание, чтение, изменение, удаление пользователя"
